{
  "$schema": "../../../schemas/animation-qa-decision.schema.json",
  "asset_id": "animations:bam:AM0602L1",
  "correction_id": "ar0601-all-bam-apo8-x4-30fps-v2",
  "decision": "Formalisation le 2026-10-11 de la validation utilisateur historique déjà acquise ; aucune nouvelle visite ingame. Octets, géométrie, cycles, cadence et variantes conservés dans le snapshot QA ; propagation de la même ressource aux zones inventoriées par identité, sans déduire de visites exhaustives. Source : pipeline/recipes/animations-cleanup-points1-3-20261011-v1/historical-registry-rows.json. Notes acquises : Air Plane (AR0601, antichambre du donjon d'Irenicus); x4 SeedVR2 7B/LAB (run ar0601-all-bam-seedvr7b-lab-x4); V2 TimedTimeline 30 FPS apo-8 (run ar0601-all-bam-apo8-x4-30fps-v2); 6 frames natives -> 12 frames (12 phases); livré par pack de zone; QA en jeu validée par l'utilisateur le 2026-08-23.",
  "decision_date": "2026-08-23",
  "decision_id": "2026-10-11-preserved-historical-am0602l1-v1",
  "decision_origin": "explicit-user-ingame-qa",
  "final_run": {
    "manifest_path": "animations/ressources/AM0602L1/runs/am0602l1-historical-qa-bound-20261011-v1/manifest.json",
    "manifest_sha256": "340444073EB179E57CCCDE819E41DF0DADAED8749EB698FEFAC2633161C8789C",
    "path": "animations/ressources/AM0602L1/runs/am0602l1-historical-qa-bound-20261011-v1",
    "schema": "bg2-upscale-historical-qa-binding-run-v1",
    "status": "completed"
  },
  "lineage": {
    "source_packs": [],
    "source_runs": []
  },
  "recipe_id": "animations-cleanup-points1-3-20261011-v1",
  "recorded_at_utc": "2026-10-11T19:44:18Z",
  "resref": "AM0602L1",
  "result_kind": "x4",
  "schema_version": 1,
  "source_pack": {
    "areas": [
      {
        "area": "AR0601",
        "manifest_path": "animations/packs-par-zone/am0602l1-historical-qa-bound-20261011-v1/AR0601/manifest.json",
        "manifest_sha256": "D02ECE1B3DF210E2CBE02443C803BC102B0C3CF7A2E16EF04A21D8BA68B7B80E",
        "path": "animations/packs-par-zone/am0602l1-historical-qa-bound-20261011-v1/AR0601",
        "registry_sha256": "8A3A78033ECA6EFFD497197897DF15893934D3B85B02DAB57ADC1CF8DE284C0A",
        "resource_entries": 1
      }
    ],
    "manifest_path": "animations/packs-par-zone/am0602l1-historical-qa-bound-20261011-v1/manifest.json",
    "manifest_sha256": "70F8707CA00144CAC1897291AFBFFD8BEA33C4876DEB44F1091021EB81DFFA00",
    "path": "animations/packs-par-zone/am0602l1-historical-qa-bound-20261011-v1",
    "schema": "bg2-upscale-area-animation-pack-index-v1",
    "status": "completed"
  },
  "status": "accepted",
  "tested_areas": [
    "AR0601"
  ]
}
