{
  "$schema": "../../../schemas/animation-qa-decision.schema.json",
  "asset_id": "animations:bam:AM307UR3",
  "correction_id": "ar0307-ar0329-six-bam-apo8-x4-30fps-v2-20260831",
  "decision": "Formalisation le 2026-10-11 de la validation utilisateur historique déjà acquise ; aucune nouvelle visite ingame. Octets, géométrie, cycles, cadence et variantes conservés dans le snapshot QA ; propagation de la même ressource aux zones inventoriées par identité, sans déduire de visites exhaustives. Source : pipeline/recipes/animations-cleanup-points1-3-20261011-v1/historical-registry-rows.json. Notes acquises : Coffre ; x4 SeedVR2 7B/LAB, neutralisation RGB sous alpha nul, puis V2 TimedTimeline 30 FPS apo-8 (run ar0307-ar0329-six-bam-apo8-x4-30fps-v2-20260831 ; 4 frames natives -> 8 frames, 8 phases ; neutralisation réappliquée après interpolation) ; livré par pack de zone combined-20260831-ar0307-ar0329-six-bam-30fps-v2 ; QA ingame utilisateur validée le 2026-08-31.",
  "decision_date": "2026-08-31",
  "decision_id": "2026-10-11-preserved-historical-am307ur3-v1",
  "decision_origin": "explicit-user-ingame-qa",
  "final_run": {
    "manifest_path": "animations/ressources/AM307UR3/runs/am307ur3-historical-qa-bound-20261011-v1/manifest.json",
    "manifest_sha256": "0D729C53C7ED37159DEFCB1988290D31436431240AD824BCFC83914B8769A2FC",
    "path": "animations/ressources/AM307UR3/runs/am307ur3-historical-qa-bound-20261011-v1",
    "schema": "bg2-upscale-historical-qa-binding-run-v1",
    "status": "completed"
  },
  "lineage": {
    "source_packs": [],
    "source_runs": []
  },
  "recipe_id": "animations-cleanup-points1-3-20261011-v1",
  "recorded_at_utc": "2026-10-11T19:44:30Z",
  "resref": "AM307UR3",
  "result_kind": "x4",
  "schema_version": 1,
  "source_pack": {
    "areas": [
      {
        "area": "AR0307",
        "manifest_path": "animations/packs-par-zone/am307ur3-historical-qa-bound-20261011-v1/AR0307/manifest.json",
        "manifest_sha256": "E1009EDC98113EEF1A4A35EDF86080C3D7540DCD579405537BE950D0EA8C3B0B",
        "path": "animations/packs-par-zone/am307ur3-historical-qa-bound-20261011-v1/AR0307",
        "registry_sha256": "9BCF286893448339D33367A19E3C3055D0548E67E8FACE3B0C1A4C302EDB6C65",
        "resource_entries": 1
      },
      {
        "area": "AR0329",
        "manifest_path": "animations/packs-par-zone/am307ur3-historical-qa-bound-20261011-v1/AR0329/manifest.json",
        "manifest_sha256": "FBA7D55D6FB07E56833E5F8E6C82DA640B8E6AADB465BE32FD0E692D2D3F086A",
        "path": "animations/packs-par-zone/am307ur3-historical-qa-bound-20261011-v1/AR0329",
        "registry_sha256": "9BCF286893448339D33367A19E3C3055D0548E67E8FACE3B0C1A4C302EDB6C65",
        "resource_entries": 1
      }
    ],
    "manifest_path": "animations/packs-par-zone/am307ur3-historical-qa-bound-20261011-v1/manifest.json",
    "manifest_sha256": "550F8E355AD3AF789C05FB024A5A2AAA9652F01D769D913BCDDDBA12BB6D4645",
    "path": "animations/packs-par-zone/am307ur3-historical-qa-bound-20261011-v1",
    "schema": "bg2-upscale-area-animation-pack-index-v1",
    "status": "completed"
  },
  "status": "accepted",
  "tested_areas": [
    "AR0307",
    "AR0329"
  ]
}
